{
  "schema_version": "1.0",
  "message_id": "message_launch_brief",
  "task_id": "task_launch_campaign",
  "sequence": 1,
  "role": "user",
  "kind": "text",
  "content": "请优先探索自然光与高对比度排版。",
  "asset_refs": [
    {
      "asset_id": "asset_brand_guide",
      "manifest_relpath": "resources/manifests/asset_brand_guide.json"
    }
  ],
  "created_at": "2026-08-22T09:02:00Z"
}
